{
  "base_sha256": "ae4d8f58b07cc79f60dbfbe41ad0ca73d466bfd4f9f469c0650bc039d4c7b364",
  "engine_version": "v3d.mutation-engine.v1",
  "expected_failing_gate": "ppa",
  "expected_mode": "OPTIMIZE",
  "mutated_sha256": "5d879d8765b54a4286e241cb5440e2dd1a2c019d803934dc722fc61628141bad",
  "mutation_summary": "映射循环缺少展开并行性。",
  "operator": "opt_remove_unroll",
  "operator_version": 1,
  "schema_version": "v3d.mutation-manifest.v1",
  "seed": 404,
  "source_range": {
    "base_end_line": 12,
    "base_range_sha256": "39d5cc5cb47bbcf02fd077dff227d1c962dd8b02b622ef0123b450673376a2a3",
    "base_start_line": 5,
    "file": "kernel.cpp",
    "mutated_end_line": 10,
    "mutated_start_line": 4
  },
  "task_id": "v3d_fast_024",
  "version": 1
}
