{
  "base_sha256": "bcb793c46dbf2422b2e48deb8448f8f7da030b1174db66640147a6b043da1d9a",
  "engine_version": "v3d.mutation-engine.v1",
  "expected_failing_gate": "cosim",
  "expected_mode": "STRUCTURAL_FIX",
  "mutated_sha256": "694b458fd80997fec2d2ce8165252afddbb273256e795ce9d7a25cf80556708c",
  "mutation_summary": "生产者每周期写入三个节拍 token，而消费者只读取一个。",
  "operator": "struct_producer_consumer_rate_mismatch",
  "operator_version": 1,
  "schema_version": "v3d.mutation-manifest.v1",
  "seed": 305,
  "source_range": {
    "base_end_line": 14,
    "base_range_sha256": "c9349daffd534e814200b62a1b8eacb44dba17163b192fd9a49be6151b181931",
    "base_start_line": 4,
    "file": "kernel.cpp",
    "mutated_end_line": 16,
    "mutated_start_line": 3
  },
  "task_id": "v3d_fast_019",
  "version": 1
}
