{
  "base_sha256": "44f55304720ac529fb50308484dfac68c4e9a8451252200fe211e9a92b3022e4",
  "engine_version": "v3d.mutation-engine.v1",
  "expected_failing_gate": "synth",
  "expected_mode": "SYNTH_FIX",
  "mutated_sha256": "f7b1dbe0d63585132e5f7b6893516a79f418978ef44ab5877a1bcec40b39c5e1",
  "mutation_summary": "C 仿真正确，但核心路径使用动态内存。",
  "operator": "synth_dynamic_allocation",
  "operator_version": 1,
  "schema_version": "v3d.mutation-manifest.v1",
  "seed": 201,
  "source_range": {
    "base_end_line": 8,
    "base_range_sha256": "4b80451f991e57b02a42c55ddefef4cd2a9d715aa4b29e1288f18642f5077b4c",
    "base_start_line": 4,
    "file": "kernel.cpp",
    "mutated_end_line": 10,
    "mutated_start_line": 3
  },
  "task_id": "v3d_fast_009",
  "version": 1
}
