{
  "base_sha256": "c01d2757e1ba01b2e3751d12c97788b95c41c83e8169c07f66abfbd2495582da",
  "engine_version": "v3d.mutation-engine.v1",
  "expected_failing_gate": "cosim",
  "expected_mode": "STRUCTURAL_FIX",
  "mutated_sha256": "13fbb3c35eb8710662198e609b3f43df40c6a2bb5bfc39342c819d2494c11cf3",
  "mutation_summary": "双流生产者先突发写主流，RTL 有界 FIFO 形成背压环。",
  "operator": "struct_main_burst",
  "operator_version": 1,
  "schema_version": "v3d.mutation-manifest.v1",
  "seed": 301,
  "source_range": {
    "base_end_line": 14,
    "base_range_sha256": "5f8045f120b6f94e66c521c7946419225c83bc4060952d97cb238dfe1c057b60",
    "base_start_line": 4,
    "file": "kernel.cpp",
    "mutated_end_line": 14,
    "mutated_start_line": 3
  },
  "task_id": "v3d_fast_015",
  "version": 1
}
