{
  "base_sha256": "5372e6e44b5f2cba348143f0958cddedd455d28a6ac02f8695dab2cef55a52ef",
  "engine_version": "v3d.mutation-engine.v1",
  "expected_failing_gate": "csim",
  "expected_mode": "REPAIR",
  "mutated_sha256": "3ef03edb5151b99afab5c7e4f7149c39e9cec165e2e2ea827ec44e5715709f6b",
  "mutation_summary": "符号分支对非负输入采用错误公式。",
  "operator": "repair_branch_inversion",
  "operator_version": 1,
  "schema_version": "v3d.mutation-manifest.v1",
  "seed": 107,
  "source_range": {
    "base_end_line": 7,
    "base_range_sha256": "6302b119010f1ce3fa60e9bd98c9bbc82455679a904aea7d1fb64a919a93ec40",
    "base_start_line": 5,
    "file": "kernel.cpp",
    "mutated_end_line": 10,
    "mutated_start_line": 4
  },
  "task_id": "v3d_fast_007",
  "version": 1
}
