{
  "base_sha256": "7e88112dcbfe6556bcf459606f2438e7c4bd04bf2cb225843036ebf964f33354",
  "engine_version": "v3d.mutation-engine.v1",
  "expected_failing_gate": "synth",
  "expected_mode": "SYNTH_FIX",
  "mutated_sha256": "2af0d9af04c956e11f815d67fdca0c482ee43626fe5aafaa60dfac99cba9d343",
  "mutation_summary": "矩阵乘法数据路径使用动态 std::vector 暂存。",
  "operator": "synth_matmul_unsupported_stl",
  "operator_version": 1,
  "schema_version": "v3d.mutation-manifest.v1",
  "seed": 204,
  "source_range": {
    "base_end_line": 17,
    "base_range_sha256": "d89237e735d85042852cdd0cf597b1108a48ca1ef118e12f7c64591db2b9f9c0",
    "base_start_line": 4,
    "file": "kernel.cpp",
    "mutated_end_line": 25,
    "mutated_start_line": 3
  },
  "task_id": "v3d_fast_012",
  "version": 1
}
